#;;;;;;;;;;;;;x;;;
will_receive_title;Request A Grant;;;;;;;;;;;;x;;;
will_receive_desc;Has the ye old piggybank run out? Running education at a premium? Surely there is someone out there kind enough to help a friend out. This will request a grant from other players. Please note they must have chosen the decision to enable giving grants for the request to go through. It can be reversed at any time.;;;;;;;;;;;;x;;;
#will_not_receive_title;Disable Receiving Grants;;;;;;;;;;;;x;;;
#will_not_receive_desc;This will prohibit other players from giving us grants. It can be reversed at any time.;;;;;;;;;;;;x;;;
will_give_title;Enable Giving Grants and Negotiated Transfers;;;;;;;;;;;;x;;;
will_give_desc;This will allow us to give grants to other player, and for other players to justify Negotiated Transfers against us. It must be activated before a player chooses to request grants, and for other players to justify Negotiated Transfers against us. It can be reversed at any time.;;;;;;;;;;;;x;;;
will_not_give_title;Disable Giving Grants and Negotiated Transfers;;;;;;;;;;;;x;;;
will_not_give_desc;You need money to build what? A wall? And you want me to pay for it? This will prevent us from getting events when other players request grants and prevent players from having the ability to justify Negotated Transfer against us. It can be reversed at any time.;;;;;;;;;;;;x;;;